{
  "$schema": "http://json-schema.org/draft-07/schema#",
  "definitions": {
    "ChecksConfigOutput": {
      "description": "Pipeline-level checks configuration projected into the discover output.\n\nThis is intentionally a thin projection of `rocky_core::config::ChecksConfig` — only the fields downstream orchestrators currently consume are exposed. Add fields as new integrations need them.",
      "properties": {
        "configured_checks": {
          "additionalProperties": {
            "items": {
              "$ref": "#/definitions/ResolvedCheckNameOutput"
            },
            "type": "array"
          },
          "description": "Resolved per-model check names the pipeline will emit as `CheckResult.name` at run time, keyed by unqualified table/model name. Only the NON-default checks are listed — the four defaults (row_count/column_match/freshness/anomaly) are well-known and pre-declared by consumers. A consumer (e.g. Dagster) declares an asset-check spec per name so the spec name byte-matches the emitted result. Empty (and omitted) when no non-default checks are configured.",
          "type": "object"
        },
        "freshness": {
          "anyOf": [
            {
              "$ref": "#/definitions/FreshnessConfigOutput"
            },
            {
              "type": "null"
            }
          ]
        }
      },
      "type": "object"
    },
    "CollisionCandidateOutput": {
      "description": "A cross-source collision: one external object id mapped to more than one target path (the same object onboarded twice under different schemas).",
      "properties": {
        "external_object_id": {
          "description": "The shared external object id (e.g. a Fivetran ad-account id).",
          "type": "string"
        },
        "sources": {
          "description": "The distinct source schemas that resolve to it (≥2), sorted.",
          "items": {
            "type": "string"
          },
          "type": "array"
        }
      },
      "required": [
        "external_object_id",
        "sources"
      ],
      "type": "object"
    },
    "ExcludedTableOutput": {
      "description": "A table that the discovery adapter reported but that is missing from the source warehouse, so the run skipped it. Tracked separately from `errors` because it is not a runtime failure — the row never made it past the pre-flight existence check.",
      "properties": {
        "asset_key": {
          "description": "Dagster-style asset key path (`[source_type, ...components, table]`).",
          "items": {
            "type": "string"
          },
          "type": "array"
        },
        "reason": {
          "description": "Why the table was excluded. Currently always `\"missing_from_source\"` but kept as a free-form field so future causes (disabled, sync_paused, ...) can be added without a schema break.",
          "type": "string"
        },
        "source_schema": {
          "description": "Source schema the table was expected to live in.",
          "type": "string"
        },
        "table_name": {
          "description": "Bare table name as reported by the discovery adapter.",
          "type": "string"
        }
      },
      "required": [
        "asset_key",
        "reason",
        "source_schema",
        "table_name"
      ],
      "type": "object"
    },
    "FailedSourceOutput": {
      "description": "A source the discovery adapter attempted to fetch metadata for and failed.\n\nSurfaced on `DiscoverOutput.failed_sources` so downstream consumers can distinguish a transient fetch failure from a deletion when diffing successive discover snapshots (FR-014).",
      "properties": {
        "cooldown_seconds": {
          "description": "Backoff hint in whole seconds. Populated by adapters whose failure mode carries a known cooldown — currently only the Fivetran adapter when its shared circuit breaker trips. Orchestrators use it as a `retry_after` hint when scheduling a delayed re-discover. Absent for failure classes without an engine-supplied hint.",
          "format": "uint64",
          "minimum": 0.0,
          "type": [
            "integer",
            "null"
          ]
        },
        "error_class": {
          "description": "Coarse error class so consumers can branch without parsing the `message`. One of `\"transient\"` / `\"timeout\"` / `\"rate_limit\"` / `\"auth\"` / `\"unknown\"`.",
          "type": "string"
        },
        "id": {
          "description": "Adapter-side identifier for the source (e.g. Fivetran connector_id).",
          "type": "string"
        },
        "message": {
          "description": "Human-readable error from the adapter — for logs / debugging only. Don't pattern-match on this; use `error_class` for branching.",
          "type": "string"
        },
        "schema": {
          "description": "Source schema name the adapter would have written into.",
          "type": "string"
        },
        "source_type": {
          "description": "Adapter type (`\"fivetran\"`, `\"airbyte\"`, `\"iceberg\"`, ...).",
          "type": "string"
        }
      },
      "required": [
        "error_class",
        "id",
        "message",
        "schema",
        "source_type"
      ],
      "type": "object"
    },
    "FreshnessConfigOutput": {
      "description": "Freshness check configuration projected into the discover output.\n\nJust the scalar threshold: `[checks.freshness]` has no per-schema `overrides` key. One existed and parsed but nothing on the check path ever read it, so it was removed rather than exposed here (#1620).",
      "properties": {
        "threshold_seconds": {
          "description": "The age in seconds at which the check first fails: the smaller of `warn_after` / `error_after` (the deprecated `threshold_seconds` when the block uses it).",
          "format": "uint64",
          "minimum": 0.0,
          "type": "integer"
        }
      },
      "required": [
        "threshold_seconds"
      ],
      "type": "object"
    },
    "ResolvedCheckNameOutput": {
      "description": "A resolved check name `rocky discover` projects so a consumer can pre-declare a matching check spec. `name` byte-matches the `CheckResult.name` the runner emits at run time. `candidate` is `true` for names whose existence depends on runtime-discovered siblings (`cross_source_overlap`) and so may not be emitted on every run.",
      "properties": {
        "candidate": {
          "type": "boolean"
        },
        "kind": {
          "description": "The check-kind tag: `custom` | `assertion` | `null_rate` | `cross_source_overlap`.",
          "type": "string"
        },
        "name": {
          "type": "string"
        }
      },
      "required": [
        "kind",
        "name"
      ],
      "type": "object"
    },
    "SourceOutput": {
      "description": "A discovered source (connector, schema, integration — terminology varies by adapter).",
      "properties": {
        "components": {
          "additionalProperties": true,
          "description": "Schema pattern components parsed from the source schema name. Keys are the component names from the schema pattern config. e.g., {\"tenant\": \"acme\", \"regions\": [\"us_west\"], \"source\": \"shopify\"}",
          "type": "object"
        },
        "id": {
          "type": "string"
        },
        "last_sync_at": {
          "format": "date-time",
          "type": [
            "string",
            "null"
          ]
        },
        "metadata": {
          "additionalProperties": true,
          "description": "Adapter-namespaced metadata surfaced by the discovery adapter.\n\nKeys are conventionally prefixed with the adapter kind (e.g. `fivetran.service`, `fivetran.connector_id`, `fivetran.custom_reports`, `fivetran.custom_tables`, `fivetran.schema_prefix`) so entries from different adapters don't collide when an orchestrator folds them into an asset graph. Values are opaque `serde_json::Value` — Rocky relays service-specific payloads rather than modelling them.\n\nEmpty for adapters that haven't opted in; the field is skipped from the wire format in that case so existing fixtures stay byte-stable. Populated per-adapter in the discover command — see [`rocky_core::source::DiscoveredConnector::metadata`].",
          "type": "object"
        },
        "source_type": {
          "type": "string"
        },
        "tables": {
          "items": {
            "$ref": "#/definitions/TableOutput"
          },
          "type": "array"
        }
      },
      "required": [
        "components",
        "id",
        "source_type",
        "tables"
      ],
      "type": "object"
    },
    "TableOutput": {
      "properties": {
        "name": {
          "type": "string"
        },
        "row_count": {
          "format": "uint64",
          "minimum": 0.0,
          "type": [
            "integer",
            "null"
          ]
        }
      },
      "required": [
        "name"
      ],
      "type": "object"
    }
  },
  "description": "JSON output for `rocky discover`.",
  "properties": {
    "checks": {
      "anyOf": [
        {
          "$ref": "#/definitions/ChecksConfigOutput"
        },
        {
          "type": "null"
        }
      ],
      "description": "Pipeline-level data quality check configuration. Present when the pipeline declares a `[checks]` block in `rocky.toml`. Downstream orchestrators (e.g. Dagster) consume this to attach asset-level freshness policies and check expectations without re-reading `rocky.toml` themselves."
    },
    "collision_candidates": {
      "description": "Groups of ≥2 discovered sources sharing the SAME external object id but resolving to DIFFERENT target paths — the same underlying object onboarded twice. Populated only when discovery's `on_collision` is `warn`/`error` and the adapter supplies `external_object_id`; empty (and omitted from the wire format) otherwise.",
      "items": {
        "$ref": "#/definitions/CollisionCandidateOutput"
      },
      "type": "array"
    },
    "command": {
      "type": "string"
    },
    "excluded_tables": {
      "description": "Tables filtered out of `sources` because they were reported by the discovery adapter but do not exist in the source warehouse. Same shape as `RunOutput.excluded_tables` so consumers can use one parser. Empty when nothing was filtered.",
      "items": {
        "$ref": "#/definitions/ExcludedTableOutput"
      },
      "type": "array"
    },
    "failed_sources": {
      "description": "Sources the discovery adapter attempted to fetch metadata for and failed (transient HTTP error, timeout, rate-limit budget exhausted, auth blip). Their absence from `sources` does NOT mean they were removed upstream — consumers diffing against a prior run must treat failed sources as \"unknown state, do not delete.\" Empty when discovery completed cleanly. See FR-014.",
      "items": {
        "$ref": "#/definitions/FailedSourceOutput"
      },
      "type": "array"
    },
    "new_sources": {
      "description": "Source schemas seen for the first time relative to the prior persisted `discover` snapshot — the catch-a-duplicate-at-onboarding signal. Populated only when the pipeline's discovery config sets `report_new_sources`; empty (and omitted from the wire format) otherwise. The first-ever discover of a pipeline establishes the baseline and reports none.",
      "items": {
        "type": "string"
      },
      "type": "array"
    },
    "schemas_cached": {
      "description": "Number of schema-cache entries written by this invocation.\n\nPopulated by `rocky discover --with-schemas` — the explicit warm-up path for the schema cache. Zero — and omitted from the wire format — when `--with-schemas` isn't set, so fixtures captured without the flag stay byte-stable.",
      "format": "uint",
      "minimum": 0.0,
      "type": "integer"
    },
    "sources": {
      "items": {
        "$ref": "#/definitions/SourceOutput"
      },
      "type": "array"
    },
    "sync_trigger": {
      "description": "`true` when the pipeline starts its own source syncs (`[pipeline.<name>.source.discovery.sync] trigger = true`). Rocky then advances each connector's `last_sync_at` itself, so an orchestrator that runs the pipeline whenever `last_sync_at` moves (the Dagster source sensor) would start a second run per sync, and should stand down. Read from config, not from run state, so it does not change with `rocky run --no-sync-trigger`. Omitted when `false`.",
      "type": "boolean"
    },
    "version": {
      "type": "string"
    }
  },
  "required": [
    "command",
    "sources",
    "version"
  ],
  "title": "DiscoverOutput",
  "type": "object"
}
