{
  "version": "0.0.0-SENTINEL",
  "command": "discover",
  "sources": [
    {
      "id": "raw__orders",
      "components": {
        "source": "orders"
      },
      "source_type": "duckdb",
      "last_sync_at": null,
      "tables": [
        {
          "name": "orders"
        }
      ]
    }
  ],
  "checks": {
    "row_count": false,
    "column_match": false
  }
}
